{
  "request_id": "xref-extraction-request-001",
  "schema_version": "1.0",
  "operation": "exact_base_xref_extraction",
  "drawing_full_path": "C:\\temp\\s3b-candidate-input.dwg",
  "drawing_sha256": "bbbbbbbbbbbbbbbbbbbbbbbbbbbbbbbbbbbbbbbbbbbbbbbbbbbbbbbbbbbbbbbb",
  "parameters": {
    "run_id": "run-001",
    "source_full_path": "C:\\approved\\base-vehicle.dwg",
    "source_revision": "rev-2026-08-05-01",
    "inspection_expectations": {
      "source": {
        "source_id": "base-vehicle-001",
        "revision": "rev-2026-08-05-01",
        "sha256": "aaaaaaaaaaaaaaaaaaaaaaaaaaaaaaaaaaaaaaaaaaaaaaaaaaaaaaaaaaaaaaaa"
      },
      "identity": {
        "vehicle": "vehicle-001",
        "model": "model-x"
      },
      "critical_dimensions": [
        {"control": "wheelbase", "target": 2750.0, "tolerance": 1.0, "unit": "mm"},
        {"control": "track", "target": 1600.0, "tolerance": 1.0, "unit": "mm"},
        {"control": "chassis", "target": 4200.0, "tolerance": 2.0, "unit": "mm"},
        {"control": "cabin", "target": 1850.0, "tolerance": 2.0, "unit": "mm"},
        {"control": "axle", "target": 1200.0, "tolerance": 1.0, "unit": "mm"}
      ],
      "xref": {
        "name": "BASE_XREF"
      },
      "components": [
        {
          "component_type": "BLOCK",
          "logical_component_id": "chassis-main",
          "provenance": "REUSED_FROM_BASE_CAD",
          "source_block": "CHASSIS_MAIN",
          "source_handle": "A1B2",
          "source_layer": "BODY"
        },
        {
          "component_type": "BLOCK",
          "logical_component_id": "cabin-main",
          "provenance": "REUSED_FROM_BASE_CAD",
          "source_block": "CABIN_MAIN",
          "source_handle": "C3D4",
          "source_layer": "BODY"
        }
      ]
    },
    "extraction_plan": {
      "approval": {
        "reference": "approval-example-001",
        "status": "APPROVED"
      },
      "base_source": {
        "relative_path": "approved/base-vehicle.dwg",
        "revision": "rev-2026-08-05-01",
        "sha256": "aaaaaaaaaaaaaaaaaaaaaaaaaaaaaaaaaaaaaaaaaaaaaaaaaaaaaaaaaaaaaaaa",
        "source_id": "base-vehicle-001"
      },
      "components": [
        {
          "bounding": {
            "max": {"x": 2100.0, "y": 900.0, "z": 1200.0},
            "min": {"x": 0.0, "y": -900.0, "z": 0.0}
          },
          "component_type": "BLOCK",
          "logical_component_id": "chassis-main",
          "provenance": "REUSED_FROM_BASE_CAD",
          "source_block": "CHASSIS_MAIN",
          "source_handle": "A1B2",
          "source_layer": "BODY",
          "transform": {
            "rotation_degrees": 0.0,
            "translation": {"x": 10.0, "y": 20.0, "z": 0.0},
            "uniform_scale": 1.0
          }
        },
        {
          "bounding": {
            "max": {"x": 1700.0, "y": 700.0, "z": 1800.0},
            "min": {"x": 500.0, "y": -700.0, "z": 800.0}
          },
          "component_type": "BLOCK",
          "logical_component_id": "cabin-main",
          "provenance": "REUSED_FROM_BASE_CAD",
          "source_block": "CABIN_MAIN",
          "source_handle": "C3D4",
          "source_layer": "BODY",
          "transform": {
            "rotation_degrees": 2.5,
            "translation": {"x": 0.0, "y": 0.0, "z": 5.0},
            "uniform_scale": 1.0
          }
        }
      ],
      "impacted_views": [
        {"identity": "model-space", "name": "Model"},
        {"identity": "layout-001", "name": "Layout1"}
      ],
      "inspection_id": "inspection-001",
      "plan_id": "extraction-plan-001",
      "provenance": "REUSED_FROM_BASE_CAD",
      "request_id": "xref-inspection-request-001",
      "run_id": "run-001",
      "schema_version": "exact-base-xref-extraction-plan-1.0",
      "source_revision": "rev-2026-08-05-01",
      "target_drawing_sha256": "bbbbbbbbbbbbbbbbbbbbbbbbbbbbbbbbbbbbbbbbbbbbbbbbbbbbbbbbbbbbbbbb",
      "transform_policy": "LOCAL_TRANSLATION_ROTATION_UNIFORM_SCALE_ONLY"
    },
    "target_role": "DISPOSABLE_CANDIDATE",
    "candidate_output_path": "C:\\temp\\s3b-candidate-output.dwg"
  },
  "approval": {
    "reference": "approval-example-001",
    "status": "APPROVED"
  }
}
